product_uid,product_description
100371,"This ultra-strong, single-fold ramp provides the safety and strength required while remaining lightweight and portable. The smooth and quiet action of the live hinge - a continuous full length low profile hinge - adds strength and stability to the ramp. Ergonomically designed flexible, non-breakable handles offer convenient carrying and a comfortable grip. Features an extruded non-skid tread for superior traction, and a self-adjusting bottom transition plate for easy conversion from ramp to ground. Welded construction provides long-term durability and safety.No pinch, non-protruding live hingeDurable ergonomically designed handles offer convenient carrying and comfortable gripEnhanced extruded tread for superior non-skid tractionOptional top lip extension (TLE) allows for rear door access on utility vehicles, SUVs, and vans"
100372,"The Hampton Bay 1-Light Brushed Nickel Warehouse Pendant is ideal for a wide variety of spaces and decor. Featuring an attractive brushed nickel finish, this functional and stylish pendant will provide plenty of bright and even illumination in living rooms, garages, dens and wherever your imagination leads you. Easy to maintain and easy to install, pair with other brushed nickel pieces from Hampton Bay for a custom and polished look.Adjustable hanging length up to 78 in.Brushed nickel finish complements a variety of decor stylesUL listedUses one 100-Watt incandescent light bulb (not included)Home Depot Protection Plan:"
100373,Build your own window and door frames with the  5/16 in. x 84 in. Aluminum Screen Frame Piece. The aluminum is easy to cut to length and easy to assemble. Perfect for the at home DIY.Used to assemble door and window framesEasy to cut to lengthAluminum constructionIncludes 1 84 in. mill aluminum frame piece84 in. LengthNote: product may vary by store
100374,"Introducing the Ryobi 2-Cycle Gas Curved Shaft String Trimmer with a full crank engine for 2X longer life. This string trimmer accepts Ryobi Expand-It Universal Brand Fit attachments adding versatility to your trimmer. Simply attach a cultivator, blower, or even a hedge trimmer to the power head and quickly move from project to project. Save time, save space and save money with the Ryobi Expand-It System. Ryobi makes string head reloads easier with the Reel-Easy String Head; thread your string, twist the head, and resume trimming. Users will experience easier starting with the Zip Start carburetor and included Ethanol Shield 2-Cycle Oil. Backed by a 3 year warranty, trust the Ryobi 2-Cycle Gas Curved Shaft String Trimmer for your outdoor trimming needs.California residents: see&nbsp;Proposition 65 informationFull crank engine for 2X longer lifeAttachment capable: accepts universal brand fit attachmentsZip Start carburetor for easier startingReel-Easy bump-feed string head for faster reloadsDual 0.095 in. lineCurved shaft for lighter trimming and less user fatigueEthanol shield 2-Cycle oil includedHome Depot Protection Plan:Ryobi String Trimmer feature:br /br /centerimg src=""http://itemvideo-dev.microsite.homedepot.com/101514/SR4/Curved%20Shaft%20Gas%20String%20Trimmer%20RY252CS%20-%20205565843.jpg"" alt=""Ryobi Crank Curved Shaft Gas String Trimmer""/centerbr /"
100375,"Replace the wheel on your dolly or cart with the Power Care 10 in. x 2-3/4 in. replacement wheel for Hand Trucks. The wheel's steel rim and rubber tread can support loads up to 175 lb., and the integrated 5/8 in. ball bearing helps the wheel roll smoothly.Use to replace wheels on dollies, carts and other hand trucksUse as a front or rear wheelSteel frame and rubber tread10 in. diameter and 2-3/4 in. widthSupports loads up to 175 lb.Ribbed-tread designIncludes an integrated 5/8 in. ball bearing for smooth operation"
100376,"Husky quality 12 in. tool bag constructed of heavy-duty, water-resistant material. This tool bag will give you years of service. There is a dual zipper on the top which makes it easier to hold different sized items. The pockets are reinforced so that you do not have to worry about the pockets failing.3-external pocketsDual zipper top12 in. L x 7 in. W x 9.5 in. HTools not includedNote: Product may vary by store"
100377,"With a vintage modern flair, Markor is inspired by mid-century architectural design. Using a modular approach, Markor offers the ability to mix and match finishes and lights for a complete fixture suited perfectly for your home.California residents: see&nbsp;Proposition 65 informationWhite handblown glass filters soft, even lightSchoolhouse shape and ridged design provide old-world charmCompatible with many light fixtures and ceiling fansSimply slide into shade holder and tighten fitter screwsTrust The Home Depot's licensed electricians to help with your ceiling fan installation, call 877-941-8832 to schedule a free in-home consultation"
100378,"Use the tarp ball bungees to easily fasten tarps to canopy frames or other similar frame structures through the tarp grommets. Tarp ball bungees tie down tarps to canopy frames without without punching holes or damage to the tarps. The 6-inch tarp ball bungees fits most tarps with grommets. The bungee length is approximately 6 inches. Ball size is approximately 1 inch. One pack of 6-inch tarp ball bungees contains 25 pieces.Easily fasten tarps or screens to canopy frames through the grommets or eyeletsTarp ball bungees are compatible with most canopy tarps, canopy tops and canopy screens with grommetsBungee length is approximately 6 inches Ball size is approximately 1 inch Fits most canopy framesTarp ball bungees are easily installed, removed or repositionedReusableGet the right coverage - click here for Home Depot's buying guide"
100379,"The DEWALT DWE7499GD table saw is ideal for rip cutting sheet material and framing lumber. This versatile saw is also ideal for making specialty cuts like, dados, rabbets, mortise and Tenons. The included rolling stand is designed for easy set up and breakdown with excellent stability. Table saw set up and transport can easily be accomplished by a single user with this saw and stand combo.Guard detection system, warns the user when the guard assembly is not installedRack and pinion fence system makes fence adjustments fast, smooth and accuratePatented material support can be used for narrow rip cuts32-1/2 in. rip capacity easily cuts a variety of larger shelving and trims materialsOn board storage system provides easy access to the Site-Pro guard components and push stick when not in useAllows for tool free adjustments of the guarding components appropriate for each applicationTelescoping fence rails retract to create a small, portable packageFlip over ripping fence allows for narrow rip cuts15 Amp motor quickly rips through hardwoods with ease2 in. dust collection port easily connects to a vacuum for efficient dust extraction3-1/8 in. depth of cut at 90 and 2-1/4 in. at 4526-1/4 in. x 22 in. table provides superior material supportHome Depot Protection Plan:"
100380,"This HDX 5-Shelf Storage Unit offers commercial-grade shelving and is ideal for creating storage space in any room, whether for commercial, industrial or residential use. The heavy-duty shelving unit can support 1750 lbs. for optimal use in kitchens, pantries, utility rooms, warehouses and garages, featuring tubular steel construction with a durable black finish. All 5 shelves are easily adjustable to ensure items fit perfectly, and the unit can be conveniently assembled without any tools.Heavy-duty weight capacity of 1750 lbs.No tools required for easy assemblyTubular steel construction with durable black finish offers solid support for a variety of heavy or bulky itemsPerfect storage solution for commercial or residential use in any room, office or jobsite5 adjustable shelves are ideal for changing storage needsNSF-certified for food storage"
100381,"The 3/4 in. SharkBite x 3/4 in. Female Pipe Thread Ball Valve is the easiest way to install a new or replacement shut-off ball valve. The single lever control allows for easy operation and the valve is perfect for potable water and hydronic applications where a shut-off is needed. SharkBite fittings allow you to join copper, CPVC or PEX pipe in any combination with no soldering, clamps, unions or glue. Just insert the pipe and the stainless steel teeth bite down and grip tight, while a specially formulated O-ring compresses to create a perfect seal. Disassembly is just as fast using the simple disconnect tool so fittings and valves can be easily changed and reused. They can even be rotated after assembly for easier installation in tight spaces. Get SharkBite and get a grip on your next plumbing project.California residents: see&nbsp;Proposition 65 informationLead free DZR brass construction for durability and reliabilityUse-to-connect to any combination of copper, PEX, CPVC, or PE-RT pipesInnovative push-to-connect design makes for quick and easy installationPush-to-connect fittings require no solder, glue, unions, or toolsFitting can be rotated on pipe after installation making it easier to work in tight spacesDesigned for potable water distribution as well as hydronic heating applicationsCorrosion resistant to improve longevityCertified as a manufactured joint and for underground and behind-the-wall applications without access panelsListed by IAPMO and design certified and listed to ASSE 1061/NSF 61Meets all UPC, IPC, and cUPC requirementsDemount clip allows user to release the fitting from the pipe for convenient installation flexibility (sold separately)Rated to 200F and 200 PSI"
100382,"WM 180 Brick Mold  1-1/4 x 2"" x 7' Primed Finger Jointed Pine 84 "" long.PrimedFinger jointed84 longEasy to install"
100383,"Pavestone's 12 in. Retaining Wall is the perfect complement to residential landscape design.  The low maintenance, easy-to-install stones are a beautiful solution for any project, from gardens and tree rings to curved walls and terraces. The self-aligning rear lip and automatic setback help provide a stable, hassle-free installation. Environmentally friendly, easy to install, and attractive, its angular units accommodate both curved and straight walls to naturally flow with landscape contours. Choose the natural elegance and long-lasting beauty of Pavestone's 12 in. Retaining Wall for your next landscape creation.Made of durable drycast concreteSelf-aligning rear lip and automatic setback for stable, hassle-free installationSize and weight are approximateColor in concrete products may vary from pallet to pallet, please purchase your projects all at one timeNote: Product may vary by store"
100384,"DIG Corp's 1/4 in. x 100 ft. polyethylene micro tubing is used in the installation of drip irrigation system. It can be used either for extending drip emitters and micro-sprinklers from the main line to the plants area or as the basis of a small patio system. The durable micro tubing is manufactured of high quality, professional grade materials and can be used either above or below ground.100 ft. of tubing lengthMaximum recommended operating pressure: 60 psiMade from UV resistant materials for a long life in the landscapeUse with DIG Corp 1/4 in. barb fittingsFlexible design allows for ease of use"
100385,"Expand your kitchen workspace and add functionality with the Granite Top Kitchen Island Cart from Home Decorators Collection. Featuring solid pine construction with a natural finish and brushed nickel hardware, this cart has an elegant granite surface for a decorative touch. With a slide-out wire basket, 1 fixed shelf, 4-bottle wine rack and spacious pullout drawer, other features include heavy-duty casters for mobility that lock in place for added safety. Ideal for your kitchen or for a patio bar, this cart will provide years of use and enjoyment.Pine constructed with natural finishBrushed nickel hardwareBrushed nickel hardwareFeatures slide-out wire storage basket, 4-bottle wine rack, 1 fixed shelf, spacious pullout drawer"
100386,"Eliminate back-bending trips to the paint tray while creating a smooth, professional finish on your walls. The Smart Roller is Wagner's ultimate all-in-one roller and paint container. Transform your home with a simple squeeze of the ratchet Power Trigger which feeds paint from the on-board reservoir right to your roller and onto your walls eliminating the need for those messy paint trays. The extended handle lets you reach 8 ft. ceilings with ease. Perfect for medium-sized interior projects.Plastic handle has an integrated paint reservoir that eliminates need for paint trayPolyester knit roller cover is compatible with water-based and oil-based paints and stainsInternally fed 9 in. x 3/8 in. roller provides continuous, even paint coveragePaint up to a 7 ft. x 10 ft. area in a single fill and ratchet trigger controls paint flowThe quick connect tabs make assembly easy and tool free and the included accessories make the product easy to fill, easy to use and easy to cleanKit includes 22 oz. reservoir, suction tube and paint can lid for easy filling, 9 in. internally fed roller for semi-smooth to smooth surfaces, and spatter shield to prevent overhead dripsTo learn more about Wagner products, click hereProduct may vary by store"
100387,"The GarageEscape Slatwall Easy Panels offer the easiest way to put slatwall in your garage, home office, laundry room and storage areas. The easy to install 2 ft. x 4 ft. slatwall panels ship via ground and weigh only 20 lbs. each. They can be easily installed as singles or in a stack or a strip. Together with the GarageEscape box of slatwall accessories, they will help to organize a wide assortment of tools, gear, toys, equipment and supplies.Easy to purchaseEasy to installEasy to useEasy to arrange and rearrange as needed"
100388,"Blending subtle design elements found in craftsman furniture's chamfering techniques with the intricate facets of jewelry, the Archer collection achieves an interesting transitional aesthetic.  The vanity brings texture and visual depth to the collection, while the fixtures combine curved and beveled edges to suit an array of design motifs.8 in. center faucet holesClassic rectangular basinOverflow drainCombination consists of the K-2358-8 basin and the K-2357 pedestalCoordinates with other products in the Archer collectionConstructed of vitreous china for lasting beauty and exceptional durability"
100389,"Want it delivered to your home. Search Internet # 203273901. Window AC units are portable, and are not installed into the structure of the home or building. GE window air conditioners are designed to fit traditional-style windows. It comes with GE's EZ-mount installation.Want it delivered to your home? Search Internet # 2032739016,400 BTU, 10.7 EER, 5.6 ampsEZ mount window kitElectronic digital thermostat3 cooling / 3 fan speedsPower interruption restartNon-ozone-depleting refrigerant (R-410A)24-hour timerFits windows 21 in. - 38 in. wide, minimum height 13-1/2 in.Remote control and one-touch lift-out filterColor Appearance Light Cool GrayHome Depot Protection Plan:"
100390,"The Rheem Performance Platinum 40 Gal. Natural Gas Tall Water Heater comes with a 40,000 BTU/hour environmentally friendly low NOx burner that provides ample hot water for households with 2 to 4 people. The push button ignition system ensures safe and easy startup. Its maintenance free combustion air intake system means there are no filters to clean and replace. The self-diagnostic gas control valve monitors system performance. A premium grade anode rod provides long lasting tank protection. Factory installed temperature and pressure relief valve and 3/4 in. water connections are included with the water heater for easy installation.California residents: due to requirements from air quality management districts in the state of California, please use the map below to confirm whether you live in an area that requires the purchase of ultra low NOx water heatersDue to ultra low NOx requirements from air quality management districts in the state of California, please confirm that your shipping zip code is not restricted from the use of items that do not meet local qualificationsDelivers 73 Gal. of hot water in the first hour12 year limited warranty on tank and parts for your convenience3 year in home labor warranty for peace of mind0.62 energy factor makes this one of the most efficient gas water heaters availableMaintenance free - no filter to clean or replacePush button ignition system simplifies the startup processSelf-diagnostic gas valve monitors system performanceDesigned for easy replacement of your existing water heaterRated for installations up to 10,200 ft.Call 1-855-400-2552 before noon for same-day service in most areas, or Visit our Water Heater Installation page for more information.Meets new 2015 NAECA StandardsCalifornia Residents - See if your county requires water heaters that meet Air Quality Management District Ultra low NOx (ULN) requirements:"
100391,This 7 ft. x 1-63/64 in. x 1-15/64 in. PVC Brick Moulding is for indoor or outdoor use and is designed not to rot. The brick moulding has the same profile as traditional bricks and is for use around window and door openings. Adding Brick Moulding to your home adds value and a nice finishing touch.Vinyl is durable and easy to cleanWhite finish is both paintable and stainableMoisture rot and termite resistantCuts like wood with no special tools requiredEasily installed with nails or glueWill not split or crackFor use around windows and doorsInterior or exterior use108 in. LengthPre-mitered kit to fit any 3 ft. or smaller door casingNote: Product may vary by store
100392,"Miracle-Gro Moisture Control Potting Mix takes the guesswork out of watering. It protects against over and under watering. The mix is enriched with Miracle-Gro Plant Food to help you grow Big, Beautiful Plants Guaranteed. Miracle-Gro Moisture Control Potting Mix provides the right start for su ccess with all types of container plants, both indoors and outdoors.Protects against over and under-wateringFeeds up to 6 monthsGrows plants twice as bigAbsorbs up to 25% more water than basic potting soilUse this calculator to determine how much product you need to complete your project:"
100393,"The Roberts Extendable Floor Roller extends up to 27 in. and includes 2 handles for maximum leverage. The non-marking, segmented rollers exert even pressure to smooth out uneven vinyl floor covering, carpet or wall covering. Inset axles won't scuff walls.Use to roll vinyl floor covering, carpet and wall covering7-1/2 in. wide rollersTwist-lock handle extends to 17-27 in.Non-marking, segmented rollers"
100394,"The Waterboss 22,000-Grain Water Softener features a 16 GPM water flow rate at 15 psi drop to help provide minimal pressure drop to your shower and appliances. The built-in sediment filter helps provide clean operation, and the compact design of the softener helps save space. The softener features a controller for easy use and includes an installation DVD to help make installation easy.16 GPM water flow rate at 15 psi drop helps provide minimal pressure drop to your shower and appliancesRegeneration uses 16.4 Gal. in as little as 19-1/2 minutes to help you save water and timeCompact design helps save spaceFactory-installed bypass helps extend the longevity of the filterReduces iron by 10 PPM for clear waterSafety shut-off system helps provide safe operationIncludes do-it-yourself installation DVD to help make installation easy"
100395,"The Custom Building Products WonderBoard Lite 5 ft. x 3 ft. x 1/4 in. Backer Board provides a stable surface for installing tile or stone and protects against moisture. Ideal for both interior and exterior substrate applications. Protects against excessive moisture in wet areas such as showers, saunas and steam rooms.California residents: see&nbsp;Proposition 65 informationNew formula - Same durable performance with faster, easier installationCreates a smooth, level, stable surface for installing tile or stone on walls, floors or countertops3 ft. x 5 ft. coverage areaComposed of stable Portland cement, aggregates and reinforcement3 ft. x 5 ft. coverage area.Protects against excessive moisture in wet areas such as showers, saunas and steam rooms"
100396,"Imagine, Stack, Enjoy, reminiscent of our fondest childhood toys. Pavestone Company's innovative RumbleStone Series provides a set of rustic building block for your outdoor hardscape projects. Simple to complex, large or small, the possibilities for creative expression are as far and wide as that inner child's imagination.Concrete utility block system use one size or all four to build your projectEasy to assemble no cutting, just stack them and bond with adhesiveCreate your own project endless variety of possibilitiesRugged texture for natural appearancePallet contains 144 pieces of stone"
100397,"The MD Building Products provides a full assortment of aluminum shapes and sheets for any project you may encounter. Weldable steel sheet metal. Available in a variety of sizes and thickness. Great for auto and RV repairs, industrial fabrication and repairs and many other home and shop projects where a wieldable steel is desired. Should be painted to prevent rusting.Great for crafts and hobbiesCan be used to create countertops, workbench tops and pet-house roofsMade of 22-Gauge steelCan be weldedResists rustDurable and strongEasy to form and cut"
100398,"Teks #8 x 1 in. Hex Washer Head Self Tapping Drill Point Screws (170-Pack) provide secure metal-to-metal fastening with strong holding power without the need to pre-drill. The engineered drill-point and flute remove material efficiently and properly size the hole for threads. Teks self-tapping screws are ideal for fastening thicker gauge (20 - 12-Gauge) metal to metal in applications such as heating, ventilation, and air conditioning (attaching duct work to steel framing), electrical (attaching accessories to steel framing), and overhead steel doors, hinges, and latches. Install with a standard screw gun and a 1/4 in. hex drive bit.Ideal for securely fastening 12 - 20-gauge metal to metalExcellent for use in HVAC and electrical applicationsGreat for use with overhead steel doors, hinges and latchesMade of steelZinc platedSelf-tapping/self-drilling designEngineered drill point helps size the hole for threadsEngineered flute helps remove materialNo pre-drilling necessaryInstalls with a standard screw gun and a 1/4 in. hex drive bit (screw gun and bit are not included)"
100399,"VorMax flushing technology is the solution to maintaining a cleaner toilet bowl by simply flushing the toilet. Its revolutionary VorMax flushing system completely cleans the entire bowl, including under the rim. The VorMax flushing technology has been independently tested and proven to CLEAN 2X BETTER than conventional toilets. This helps maintain a tidier toilet bowl longer, so cleaning is a breeze. Source: Test witnessed by IAPMO R&T Labs comparing VorMax against conventional under-the-rim-water-dispersal toilets from major retailers.Includes decorative slow close seat that features a seamless, concealing lid and EverClean surface which helps keep the seat cleaner longerOptum VorMax flush technology cleans 2x better than conventional toiletsVorMax flush technology delivers a powerful jet of water that scrubs the bowl clean from top to bottom, removing everything in its pathCleanCurve rim design eliminates hidden, hard-to-reach surfaces where dirt and buildup hideEverClean surface is super smooth and easier to keep clean, even after years of use; plus, the permanent EverClean antimicrobial surface inhibits the growth of stain and odor causing bacteria on the surfaceIndustry-leading flush technology saves water without losing performance. It uses just 1.28 Gal. of water per flush, a 20% savings compared to 1.6 GPF toilets; a 20% savings in water usage translates to money savingComfortable right height, elongated bowl is ADA compliant which can help make getting on and off of the toilet easierEasy installation. Complete toilet includes everything you need for installation, including the seat and wax ringFeatures dual-injection flush valves that open almost simultaneously, delivering water to the bowl in two ways, to the jet hole for a powerful vortex scouring action in the bowl and to the trap way to create the siphon which disposes of all the wasteSuperior waste removal with a 2-1/16 in. smooth fully glazed trap way outletChrome handle100% factory flush testedWarranty: lifetime on chinaware, 10-year on all mechanical parts, 1-year on seatFor installation offer details, click here or see an associate12 in. Rough-in"
100400,"Miracle-Gro Shake 'n Feed 4.5 lb. All-Purpose Plant Food provides nutrients to flowers, vegetables, trees and shrubs to promote bigger, more beautiful flowers and more bountiful vegetables. It takes the guesswork out of feeding and shakes on in minutes. Feeds continuously for up to 3 months.Great for use anywhere, in ground and in container for all flowers, vegetables, trees, shrubs, and houseplantsCovers up to 135 sq. ft. Surface application rate equals 4.8 oz. per 10 sq. ft.Easy-to-use shaker provides a quick and clean way to feed your plantsPrevents overfeeding and burning when used as directedFeeds continuously for up to 3 months12-4-8 fertilizer analysis provides nutrients plants need to flourish"
