product_uid,product_description
100222,"The JET 1221VS is different from anything we've made before. In truth, it's different from anything that anybody has ever made before. The design is better. The features are better. The entire turning experience is better. And it all focuses on one concept Control.Unrivaled speed control60-3600 RPM variable speed slow RPM allows for precision jobs, such as threadingOptimally designed speed rangesForward to reverse is a smooth transitionInnovative ratchet style belt tension system (patent pending)Integrated, spring loaded spindle lockAn oversized/bulky item that requires delivery by truck; please be aware of the dimensions and weight of this machineJET offers full tech support in order to assist with any warranty issues; please call 1800-274-6846 for assistanceHome Depot Protection Plan:"
100223,"This Snow Blower Maintenance Kit for Ariens Compact and Sno-Tek models includes an assortment of items for performing routine maintenance on your compatible snow blower. Contains factory authorized parts. Regular maintenance will keep your snow blower performing when you need it.Includes 3 shear bolts and nuts specifically made for Ariens compact and Sno-Tek modelsIncludes a 5.25 oz. snow jet aerosol spray helps prevent snow and ice from sticking to the blower's metal housing, auger and impeller helping to prevent clogsIncludes 32 oz. bottle of Ariens 5W-30 engine oil specifically formulated for snow enginesIncludes 2 packets of fuel stabilizer which keeps gas fresh for up to a year and helps prevent carburetor varnish caused by ethanol fuelChange engine oil each season or after 25 hours of use"
100224,"The House of Fara 7/8 in. x 2-1/2 in. x 8 ft. Hardwood Chair Rail Moulding helps protect your walls and its embossed-leaf design adds decorative flair. It makes an excellent casing too and can add beauty to any project you might have. It may be clear coated, painted or stained to match your decor.California residents: see&nbsp;Proposition 65 informationSolid BasswoodCan be painted and stainedEmbossed-leaf designFor interior use96 in. LengthMade in the USA"
100225,"Made of 100% wood, the 1/4 in. x 24 in. x 4 ft. MDF Particle Board is a great choice for a in a variety of applications. The board can be finished by painting and staining.Manufactured from 100% woodSmooth surfaceCan be painted and stained1/4 in. x 24 in. x 4 ft.Note: Product may vary by store."
100226,The Husky 1/4 in. Full Port Ball Valve helps you service a system without disrupting other users or draining air from the tank. The durable brass body features a high-capacity airflow design that reduces pressure drop for better tool performance.One 1/4 in. NPT male and one 1/4 in. NPT female spigot fittingFor use with 1/4 in. I.D. piping or hoseHelps you service a system without disrupting other users or draining air from the tankCan be used as a moisture drainBrass body with steel ball and Teflon sealsHigh-capacity airflow design reduces pressure drop for better tool performanceHinges have a slight offset leaf for clearanceCovered quarter-turn handle quickly turns air on or offFasteners included
100227,"Ask for the adjustable, Adjust-A-Gate system every time for your gate needs. This line is ideal for repairing an old gate or building a new one. Including all necessary hardware & parts, our gate is assembled onsite to get the job done right, the first time. The Adjust-A-Gate system comes with all the components needed to build a sturdy, reliable gate that will serve you for years to come. You simply add rails and fence boards, you will have a gate for life. Accessories include an optional drop rod for double drive applications.2-rail Adjust-A-Gate kit, for openings of 36 in.-60 in. wide, 36 in. high frame for 3 ft., 4 ft. and 5 ft. high fencesUse for wood or composite fence gates; single or double drive useOur exclusive adjustable diagonal truss cable will keep your gate true and aligned year after yearKit includes: Vertical frame, spreader bars, frame hinges, post hinges, gate latch kit, truss cable, screws and gate stopEasy to install; perfect for the DIYerHeavy-duty hinges prevent sagging and dragging2-step powder coated all-steel frame, fade and rust resistant, square tube design"
100228,"The Wooster 9 in. Professional Roller Frame has a unique retaining spring that securely holds the roller to prevent it from walking off a cage. After painting, the cover removes with a single rap of the frame on the edge of a paint bucket. Its twin bearing system eliminates friction that causes graying and streaking in paint. The cage provides uniform, full-span support of the roller cover to prevent it from going out of round. Its handle is threaded for easy attachment to all extension poles.Durable fiberglass-reinforced nylon cage and end capsPolypropylene grip with reinforced threadsRetaining spring securely holds the rollerSmooth bearings eliminate graying and shank wearThreaded handle for easy attachment to all extension polesCover removes with a single rap of the frame on the edge of a paint bucketMade in USA"
100229,"Pacific Clay Product's Pavers are hard and durable, low maintenance and long lasting. With Pacific Clay's Pavers, a variety of patterns can be created to reflect contrast or unity. Use our pavers on sidewalks, streets, patios or pool decks. Pacific Clay's pavers provide a wide range of colors, sizes and textures (wire cut and smooth) which can be matched in dimension and color or mixed in variegated patterns.Pacific clay pavers are easy to install, low in maintenance, colorfast, low in absorption, high strength, durable and freeze thaw resistantPacific clay pavers can be used alone or accompanied with additional product offerings such as bull-nose, thin brick and face brickPacific clay's mission paver split paver covers 56 sq. ft. per palletPacific clay's colors are produced from natural clays - color ranges are inherent in the product and should be sampled accordingly56 sq. ft. per pallet, 250 pcs per pallet. 4.5 pcs. per sq. ft."
100230,"Sit back and relax in the comfort of the Andrews Patio Chaise Lounge from Hampton Bay. Featuring a rust-resistant steel frame powder-coated in a rich antique bronze, this durable chaise has sling back fabric that is UV protected for enduring beauty. A versatile complement to any outdoor setting, this adjustable back chaise lounge is also the ideal complement to other pieces from the Andrews Collection for a polished and sophisticated look.Durable steel frame holds up to 250 lb. weight capacityDurable UV protected sling fabric resists damaging sunlightAdjustable seat back allows you to adjust to your preferencesCleans easily with mild soap and water1-year limited warranty on frame"
100231,"The Everbilt Pre Plumbed Sink Tray System with 0.25 HP Sump Pump is designed for use as an alternative to direct drain sinks. Ideal for washing machines, wet bar, air conditioner and dehumidifier discharge. The system comes pre plumbed and ready to install. Its modified octagonal shape maximizes capacity while minimizing the space required. Fits into corners. The durable, automatic unit features a maximum pumping capacity of 2,850 GPH.Comes pre plumbed and ready to install40% quieter and 42% more flow than previous modelInstalls easily and drains areas such as wet bars and laundry tubs where no drain is providedModified octagonal shape maximizes capacity while minimizing the space required, fits into cornersSystem includes an automatic sump pump, a check valve and a heavy duty 6 gal. basinHome Depot Protection Plan:"
100232,"The Hampton Bay Hawkins 44 in. Ceiling Fan features a twist-and-lock installation method that offers ease in installation and helps conceal hardware for a sleek, integrated look. The fan's tarnished bronze finish, five reversible distressed oak/walnut blades and Venetian glass light kit provide a transitional style that complements a wide variety of decor styles, and the three-speed reversible control enables you to select the desired speed and direction of airflow.California residents: see&nbsp;Proposition 65 informationFive reversible distressed oak/walnut blades allow you to change your decor style without replacing the entire unitTarnished bronze finish complements a variety of decor stylesBowl light kit with venetian glassWall controlUp to 4,286 CFM airflowTwist-and-lock installation method makes it easier to install and conceal hardwareFlush mount systemIndoor use, small room: room sizes up to 10 ft. x 10 ft.Easy to installPlug includedEnergy efficientFor replacement bulbs please use GE 40W Incandescent A15 Ceiling Fan Candelabra base clear light bulbs (model#40A15CA) which can be found at The Home Depot (SKU#938-378)Not sure what size fan you need? Check out our Buying Guide for helpful tips.Need help installing your fan? Check out our Project Guide for helpful tips.Trust The Home Depot's licensed electricians to help with your ceiling fan installation, call 877-941-8832 to schedule a free in-home consultationNote: product may vary by storeNeed Help? Find support information and FAQs on our Hampton Bay Customer Support pageNote: product may vary by store"
100233,"Whether you are digging your toes in the sand and enjoying a day at the beach or sitting sideline cheering on your favorite player. The Sport Shelter by Caravan Sports has you covered. Weighing only 7 lbs., this shelter is ideal to keep in a day bag or vehicle to ensure you always have protection from the sun's harmful UV rays.Lightweight and portable, only 7 lbs.Provides UV protection from the sun's harmful raysCarry bag included for easy transportAssembles in minutesIdeal shelter for the waterfront, sideline or parkIncludes poles, cover, stake kit and carry bag"
100234,"Never walk into a dark room and fumble for a light switch again. The GE Wireless Motion-Sensing LED Wall Sconce automatically turns lights on from up to 20 ft. away. With this wall sconce, you have instant light anywhere you need it. No wiring necessary. These charming sconces provide the look of hard-wired look without damaging your walls. It is ideal for entries, stairways, closets, and more. Keyhole mounting slots for wall mounting with hardware included. Requires 4 AA batteries, not included. For indoor use only.Ideal for entryways, stairways, closets, and moreNo bulbs to replaceKeyhole mounting slots for mounting includedIndoor use onlyTwo operating modes- motion-sensing and manual on/offBattery operated, no wiring neededRequires four aa batteries (not included)"
100235,"This 2 in. x 2 in. aluminum post with dual screen channels is for additional horizontal or vertical support when constructing screen room walls. It is installed using Capri Clips sold separately. Additionally, using multiple 2 in. x 2 in. posts, a screen door frame can be constructed up to 8 ft. wide.Heavy wall structural aluminum extrusion with dual screen channelsUse with ez screen room kits to create large opening screen wall framesPowder coated for lasing finishAvailable in white and dark bronzeRecommend using with phifer's pool & patio screen with an 18 x 14 mesh for large openings"
100236,"ProFlex Anchoring Spike Packs should be used to secure ProFlex Paver Edging. They can also be used to secure EZ Connect Landscape Edging, or as a general outdoor anchoring spike for other landscaping applications. Each Spike Pack contains (4) 8 in. heavy duty nylon spikes.Click here for more information on ProFlex Paver Edging(4) ProFlex anchoring spikes are recommended for each 6 ft. piece of ProFlex paver edgingInstall spikes at each end of the edging piece and every 18 in. on a slight angleWill not rust or corrodeSuitable for use with all soil typesProFlex paver edging is sold separatelyAvailable in most Home Depot Store locations and in a 2 pack (8) online, item #1988HD-2Size : .5 in. W x 8 in. D x .5 in. H each spikeSize and weight approximate"
100237,"EcoTouch insulation is the reinvention of fiberglass insulation from Owens Corning, the industry leader that invented fiberglass insulation. Install our insulation with confidence knowing that over 70 years of innovation and experience has gone in the making of EcoTouch insulation. Unlike traditional fiberglass insulation, Owens Corning EcoTouch insulation contains more than 99% natural ingredients consisting of minerals and plant-based compounds and is verified to be formaldehyde free. Owens Corning EcoTouch insulation is third-party certified to include a minimum of 65% total recycled content for unfaced insulation and 58% for kraft faced insulation. Owens Corning EcoTouch insulation helps to control sound and temperature - keeps your home warm in the winter and cool in the summer.Dimensions: 6-1/4 in. x 23 in. x 93 in., 8 pieces (118.83 sq. ft. / bag)Application: 2 in. x 6 in. walls (Interior / exterior ), floorsCompletely fills the cavity, eliminating gaps and the need for additional handworkProvides thermal performance and helps lower monthly heating / cooling costsEcoTouch insulation helps control sound; add to bedrooms, home office, family room, utility room, kitchen and bathroomCan be combined with FOAMULAR insulating sheathing to achieve greater R-value in exterior wall applicationsBuying guide and insulation calculator:"
100238,"Rust-Oleum LeakSeal Black Spray is an easy to use, rubberized protective utility coating designed to fill and seal leaks and cracks. It provides a water-tight, flexible seal that prevents moisture penetration, rust and corrosion. LeakSeal dries to a semi-smooth, firm finish that will not sag or drip, and can be top-coated with latex or oil based paints.California residents: see&nbsp;Proposition 65 informationA durable, rubberized utility coating designed to fill and seal leaks and cracksEasy to use, limited overspray, multi-surface/multi-purpose use, for use on metal, aluminum, galvanized metal, PVC, concrete, masonry, asphalt roofing materials, vinyl siding, fiberglass and moreDry time to the touch in approximately 2 hours and cures after 24 hours12-oz. can provides coverage is can be up to 10 sq. ft. depending on the surface porosityCan be top-coated with latex or oil based paintsFlat/matte finish will not reflect lightRust and moisture resistant applies for superior protection from leaks and cracksWithstands extreme temperatures and climatesProvides ultimate UV protectionPrevents water and moisture penetration for ultimate protectionBonus size available for a limited time onlyBonus size available for a limited time only"
100239,"Rust-Oleum 1-qt. Biscuit Tub and Tile Refinishing Kit is a two-part epoxy acrylic designed to rejuvenate ceramic and porcelain surfaces like tubs, sinks and showers in just minutes. Specially formulated to provide excellent adhesion, durability and color retention in high moisture areas. It applies a smooth, porcelain-like finish that resists mildew growth for long-lasting protection and beauty.California residents: see&nbsp;Proposition 65 informationApply to ceramic, porcelain or  fiberglass tubs, sinks and tilesDurable and corrosion-resistant finishCovers up to 110 sq ft or 2 coats on a standard bathtubGlossy, porcelain-like, waterproof finishTough, hard protective coating acts like porcelain and ceramicDries to the touch in 1 hour, allow surface to fully dry for 3 days prior to water exposureTwo-part epoxy acrylic formula withstands moisture and extreme hot temperaturesCleans up easily with mineral spirits"
100240,"An ideal tile for a kitchen backsplash or bathroom surfaces, the glass and stone combination of Splashback's sample size Baroque Pearl 3D Brick Pattern Mosaic Tile create a beautifully multi-dimensionally effect. The mesh backing not only simplifies installation, it also allows the tiles to be separated which adds to their design flexibility. Sample size tiles available. See item 203061538 for full size tile.1 square foot per piece, each piece sold individually. Piece weight equals 0.75 lbs.Grade 1, first-quality stone and glass tile for wall and top use3 in. length x 6 in. wide x 5/16 in. thickGlazed smooth finish with some random shade and tone variationP.E.I. Rating 0 is suitable for walls and residential use onlyNon-Vitreous flooring has water absorption of more than 7% for indoor useC.O.F. Slipresistance/C.O.F. rating greater than .50 is recommended for standard residential applications and is marginally skid resistant. Indoor useNot frost resistantResidential and commercial useLearn how to get a Lifetime Warranty by using Custom Building Products from The Home Depot. Visit www.homedepot.com/CBPDon't forget your coordinating trim pieces, grout, backerboard, thinset and installation toolsAll online orders for this item ship via ground and may arrive in multiple boxesIt is recommended you purchase a minimum of 10% overage to account for design cuts and patternsTile samples are not returnable"
100241,This tool box is made with a durable 4 mm thick structural foam box wall gives robust structure to the stand alone units. There is an integrated water seal in every unit for protection of contents and long life for your equipment. This box fits into the metal carrier with adjustable foldable brackets which allows for tailored configuration. A central locking mechanism secures the box to the frame.Durable 4 mm thick structural foam box wall gives robust structure to the stand alone unitsIntegrated water seal in every unit for protection of contents and long life for your equipmentMetal carrier with adjustable foldable brackets allows tailored configurationCentral locking mechanism secures the box to the frameIncludes removable dividing cups
100242,"Add 600 cu. in. of workspace to the top of your ladder with the Werner Job Bucket. With the Lock-In System, the job bucket fits right into the ladder top to customize your work space. Key features include integrated tape measure and screwdriver holders along with top grooves to hold round pipes in place. This versatile, must-have ladder accessory is great for all trades including electrical, maintenance, plumbing and construction.Increases work space on top of the ladderCompatible with the OBEL00, OBPT00, OBCN00 and 6200 series step laddersProvides an additional 600 cu. in. of space, great for holding supplies and toolsFeatures a lug and socket for easy installation"
100243,"Connect in-wall speaker wire in your entertainment center using this Speaker Wall Plate from CE TECH. Wall plate has 4 binding posts that make it easy to connect up to 2 speakers. Corrosion-resistant, gold-plated posts offer high performance for in-wall applications. Wall plate has white finish.4 binding posts connect up to 2 speakersMakes for easy connection to regular speaker wire or banana plugsFor use with center-pin speaker connectionsWhite finished plate fits standard wall plate outletsGold-plated posts prevent corrosion"
100244,"Take care of your storage needs with the 2-drawer cube. Whether you are storing clothes, papers or toys, this 2-drawer storage cube has plenty of room for your belongings. The convenient shape and clean, contemporary design fit well into any room. The exterior features a laminated finish for durability and good looks.White finish2-storage drawersEasy assemblyUnlimited combination options so you can create exactly the system you need"
100245,"Protect your outdoor items from winter's wrath with our line of Hearth & Garden Patio Furniture Covers. Made from high grade Polyester, our furniture covers resist cracking, fading, tearing, and mold build up. The underside is coated with PVC for increased water resistance and further protection from the elements. You can be confident that your patio furniture is secure through the seasons. We have covers available to fit all of your needs, from tables and chairs to grills and patio heaters. You've invested a lot in your patio furniture and you should protect it with the best.Heavyweight fabric resists ripping and tearingCoated underside provides added water protectionSynthetic material resists mold and mildew buildupMaterial breaths allowing heat and moisture to escapeHighly weather resistant limiting potential for cracking in cold weatherNeutral but fashionable taupe color matches your outdoor furniture and environment"
100246,"Use Henry 208 448 oz. Wet Patch Roof Cement to seal or repair any area on your roof. This cement can even be used during a downpour to stop or prevent leaks. Coverage: Approximately 43-3/4 sq. ft. per 3.5 Gal. pails (1/8 in. thick).California residents: see&nbsp;Proposition 65 informationSeals chimneys, skylights, turbines, vents, gutters and air conditionersRepairs shingles, roll roofing, valleys, splits, cracks and raised edgesApply with roofing trowel, putty knife or caulk gunProvides long-lasting waterproofing"
100247,"Choose among several fabric options to coordinate your outdoor decor theme with these Posada Patio Dining Chairs with Bare Cushions from Hampton Bay. Or, go the DIY route and fashion your own slipcovers with fabric from another provider. Either way, these all-weather armless dining side chairs are sure to spruce up your patio, deck or porch. This item is part of the Choose Your Own Color program and comes with bare cushions (customizable slipcovers available for an additional price and shipped separately).Part of the Choose Your Own Color program, slipcovers for cushions must be purchased separatelyNo assembly required2 chairs and 2 bare cushions packed in 1 boxClean with mild soap and waterCoordinates with other patio furniture and accessories in Posada collection, available separatelyEach chair supports up to 300 lbs.2-year limited frame and weave warrantyPowder-coated steel frame is durable and rust-resistantMore options available, CLICK HERE to Choose Your Own ColorCustomizable items cannot be returned. Click here to review our return policy for additional information regarding returns<br"
100248,"Use Backer-On 1-1/4 in. Zinc-Plated Steel Flat-Head Square Cement Board Screws (200-Pack) to attach cement board to wood or light-gauge steel studs. These zinc-plated screws are perfect for moist areas, such as showers and countertops. Thread designed for easy installation. No pre-drilling required.Use to attach cement board to wood or light gauge steel studsIdeal for use with showers, backsplashes, countertops and floorsSteel constructionRolled gimlet drive is easy to start in dense boardPatented/serrated for lower installation torque#2 square drive reduces cam-outRib design under .375 in. ultrathin wafer-head counter-sinks for flush-seating in boards#10 diameter for increased strength in dense boardZinc-platedResists corrosion"
100249,"The Hampton Bay Midili 44 in. Brushed Nickel Ceiling Fan has reversible black or rosewood blades, a brushed nickel finish and a frosted opal glass light kit that provides an eye-catching accent to your home decor. The Midili offers a contemporary yet compact flywheel design and has a remote control that allows you to choose between 3 speeds and control the light kit. Uses one 14-Watt (60-Watt equivalent) medium-base CFL bulb (included).Small rooms up to 10 ft. x 10 ft.Bowl light kit with frosted opal glassUses one 14-Watt (60-Watt equivalent) medium-base CFL bulb (included)Full function handheld remote control included5 reversible rosewood or black bladesDual-mount installationConcealed screws and hardware for added beauty and stylingQuiet and wobble-free operation30 in. lead wires for easier installation of extension downrod (sold separately)0.75 in. downrod(s) in 4.5 in. L provide greater stability153 x 12 mm power plus motorLimited lifetime warrantyNeed Help? Find support information and FAQs on our Hampton Bay Customer Support pageHome Depot Protection Plan:"
100250,"The House of Fara 7/8 in. x 2-5/8 in. x 8 ft. Basswood Casing/Chair Rail can protect a wall from chairs and furniture or can be used in a variety of other ways to bring a finishing touch to a home project. Manufactured from solid white hardwood, it may be clear coated, stained or painted to match your existing decor. Its unique detail will add an architectural touch to any room or project.California residents: see&nbsp;Proposition 65 informationSolid Basswood construction for durabilitySuitable for stain or paintSmooth lines offer a simple, elegant lookProtects a wall from chairs and other furnitureCan also be used as casing, base moulding, panel moulding or as a wallpaper border8 ft. LengthMade in the USA"
100251,"Western Red Cedar is a unique and prestigious softwood with outstanding physical characteristics. It offers a rare combination of aesthetic appeal and durability, thanks to its natural decay-resistant composition.  Western Red Cedar's superior dimensional stability means that, when properly installed and maintained, project components are likely to stay straight and flat, and resist warping and cupping - season after season. In addition, cedar is easy to cut, saw and nail with common tools.California residents: see&nbsp;Proposition 65 informationAppearance grade with tight sound knots and little to no waneLumber has a rough sawn surface for a natural appearanceEasy to finish with solid or oil-based stains and clear penetrating sealersGreat for outdoor projects like fences or pergolas and gazebosCedar's decay resistance allows it to be used in weather exposed applications, without a chemical treatmentNote: Product may vary by store."
100252,The Summer Infant Sure and Secure 36 in. Extra-Tall Walk-Thru Gate is just right for safely limiting your child's access through most any doorway. This stable and adjustable gate requires only 1 hand to operate and closes automatically.Compatible with many doorwaysPressure-mounted installation can accommodate baseboardsMetal construction with a white finishFits openings 28 - 47-1/2 in. W1-handed operationOpens either way and automatically swings closed and locks36 in. HAlso useful for pets
